icd9_code	icd9_phe	potential_matches
64221	Other pre-existing hypertension, complicating pregnancy, childbirth, and the puerperium, delivered, with or without mention of antepartum condition	ICD10_code:O113:phenoname:Pre-existing hypertension with pre-eclampsia, third trimester|ICD10_code:O112:phenoname:Pre-existing hypertension with pre-eclampsia, second trimester|ICD10_code:O111:phenoname:Pre-existing hypertension with pre-eclampsia, first trimester|ICD10_code:O1032:phenoname:Pre-existing hypertensive heart and chronic kidney disease complicating childbirth|ICD10_code:O10313:phenoname:Pre-existing hypertensive heart and chronic kidney disease complicating pregnancy, third trimester|ICD10_code:O10312:phenoname:Pre-existing hypertensive heart and chronic kidney disease complicating pregnancy, second trimester|ICD10_code:O10311:phenoname:Pre-existing hypertensive heart and chronic kidney disease complicating pregnancy, first trimester|ICD10_code:O1022:phenoname:Pre-existing hypertensive chronic kidney disease complicating childbirth|ICD10_code:O10213:phenoname:Pre-existing hypertensive chronic kidney disease complicating pregnancy, third trimester|ICD10_code:O10212:phenoname:Pre-existing hypertensive chronic kidney disease complicating pregnancy, second trimester|ICD10_code:O10211:phenoname:Pre-existing hypertensive chronic kidney disease complicating pregnancy, first trimester|ICD10_code:O1012:phenoname:Pre-existing hypertensive heart disease complicating childbirth|ICD10_code:O10113:phenoname:Pre-existing hypertensive heart disease complicating pregnancy, third trimester|ICD10_code:O10112:phenoname:Pre-existing hypertensive heart disease complicating pregnancy, second trimester|ICD10_code:O10111:phenoname:Pre-existing hypertensive heart disease complicating pregnancy, first trimester
64651	Asymptomatic bacteriuria in pregnancy, delivered, with or without mention of antepartum condition	ICD10_code:O2343:phenoname:Unspecified infection of urinary tract in pregnancy, third trimester|ICD10_code:O2342:phenoname:Unspecified infection of urinary tract in pregnancy, second trimester|ICD10_code:O2341:phenoname:Unspecified infection of urinary tract in pregnancy, first trimester
64663	Infections of genitourinary tract in pregnancy, antepartum condition or complication	ICD10_code:O2393:phenoname:Unspecified genitourinary tract infection in pregnancy, third trimester|ICD10_code:O2392:phenoname:Unspecified genitourinary tract infection in pregnancy, second trimester|ICD10_code:O2391:phenoname:Unspecified genitourinary tract infection in pregnancy, first trimester
71106	Pyogenic arthritis, lower leg	ICD10_code:M00869:phenoname:Arthritis due to other bacteria, unspecified knee|ICD10_code:M00269:phenoname:Other streptococcal arthritis, unspecified knee|ICD10_code:M00169:phenoname:Pneumococcal arthritis, unspecified knee|ICD10_code:M00069:phenoname:Staphylococcal arthritis, unspecified knee
6140	Acute salpingitis and oophoritis	ICD10_code:N7003:phenoname:Acute salpingitis and oophoritis|ICD10_code:N7002:phenoname:Acute oophoritis|ICD10_code:N7001:phenoname:Acute salpingitis
83969	Closed dislocation, other location	ICD10_code:S3339XA:phenoname:Dislocation of other parts of lumbar spine and pelvis, initial encounter|ICD10_code:S031XXA:phenoname:Dislocation of septal cartilage of nose, initial encounter
8601	Traumatic pneumothorax with open wound into thorax	ICD10_code:S270XXA:phenoname:Traumatic pneumothorax, initial encounter|ICD10_code:S21309A:phenoname:Unspecified open wound of unspecified front wall of thorax with penetration into thoracic cavity, initial encounter
9881	Toxic effect of mushrooms eaten as food	ICD10_code:T620X4A:phenoname:Toxic effect of ingested mushrooms, undetermined, initial encounter|ICD10_code:T620X3A:phenoname:Toxic effect of ingested mushrooms, assault, initial encounter|ICD10_code:T620X2A:phenoname:Toxic effect of ingested mushrooms, intentional self-harm, initial encounter|ICD10_code:T620X1A:phenoname:Toxic effect of ingested mushrooms, accidental (unintentional), initial encounter
25010	Diabetes with ketoacidosis, type II or unspecified type, not stated as uncontrolled	ICD10_code:E1310:phenoname:Other specified diabetes mellitus with ketoacidosis without coma|ICD10_code:E1169:phenoname:Type 2 diabetes mellitus with other specified complication|ICD10_code:E1110:phenoname:Type 2 diabetes mellitus with ketoacidosis without coma
65451	Cervical incompetence, delivered, with or without mention of antepartum condition	ICD10_code:O3433:phenoname:Maternal care for cervical incompetence, third trimester|ICD10_code:O3432:phenoname:Maternal care for cervical incompetence, second trimester|ICD10_code:O3431:phenoname:Maternal care for cervical incompetence, first trimester
71917	Hemarthrosis, ankle and foot	ICD10_code:M25076:phenoname:Hemarthrosis, unspecified foot|ICD10_code:M25073:phenoname:Hemarthrosis, unspecified ankle
72272	Intervertebral disc disorder with myelopathy, thoracic region	ICD10_code:M5105:phenoname:Intervertebral disc disorders with myelopathy, thoracolumbar region|ICD10_code:M5104:phenoname:Intervertebral disc disorders with myelopathy, thoracic region
52321	Gingival recession, minimal	ICD10_code:K06021:phenoname:Generalized gingival recession, minimal|ICD10_code:K06011:phenoname:Localized gingival recession, minimal
65491	Other and unspecified abnormality of organs and soft tissues of pelvis, delivered, with or without mention of antepartum condition	ICD10_code:O3493:phenoname:Maternal care for abnormality of pelvic organ, unspecified, third trimester|ICD10_code:O3492:phenoname:Maternal care for abnormality of pelvic organ, unspecified, second trimester|ICD10_code:O3491:phenoname:Maternal care for abnormality of pelvic organ, unspecified, first trimester|ICD10_code:O3483:phenoname:Maternal care for other abnormalities of pelvic organs, third trimester|ICD10_code:O3482:phenoname:Maternal care for other abnormalities of pelvic organs, second trimester|ICD10_code:O3481:phenoname:Maternal care for other abnormalities of pelvic organs, first trimester|ICD10_code:O3429:phenoname:Maternal care due to uterine scar from other previous surgery
65841	Infection of amniotic cavity, delivered, with or without mention of antepartum condition	ICD10_code:O411430:phenoname:Placentitis, third trimester, not applicable or unspecified|ICD10_code:O411420:phenoname:Placentitis, second trimester, not applicable or unspecified|ICD10_code:O411410:phenoname:Placentitis, first trimester, not applicable or unspecified|ICD10_code:O411230:phenoname:Chorioamnionitis, third trimester, not applicable or unspecified|ICD10_code:O411220:phenoname:Chorioamnionitis, second trimester, not applicable or unspecified|ICD10_code:O411210:phenoname:Chorioamnionitis, first trimester, not applicable or unspecified|ICD10_code:O411030:phenoname:Infection of amniotic sac and membranes, unspecified, third trimester, not applicable or unspecified|ICD10_code:O411020:phenoname:Infection of amniotic sac and membranes, unspecified, second trimester, not applicable or unspecified|ICD10_code:O411010:phenoname:Infection of amniotic sac and membranes, unspecified, first trimester, not applicable or unspecified
64764	Other viral diseases in the mother, postpartum condition or complication	ICD10_code:O9853:phenoname:Other viral diseases complicating the puerperium|ICD10_code:O9843:phenoname:Viral hepatitis complicating the puerperium
7171	Derangement of anterior horn of medial meniscus	ICD10_code:M23319:phenoname:Other meniscus derangements, anterior horn of medial meniscus, unspecified knee|ICD10_code:M23219:phenoname:Derangement of anterior horn of medial meniscus due to old tear or injury, unspecified knee
5772	Cyst and pseudocyst of pancreas	ICD10_code:K863:phenoname:Pseudocyst of pancreas|ICD10_code:K862:phenoname:Cyst of pancreas
9982	Accidental puncture or laceration during a procedure, not elsewhere classified	ICD10_code:T888XXA:phenoname:Other specified complications of surgical and medical care, not elsewhere classified, initial encounter|ICD10_code:N9972:phenoname:Accidental puncture and laceration of a genitourinary system organ or structure during other procedure|ICD10_code:N9971:phenoname:Accidental puncture and laceration of a genitourinary system organ or structure during a genitourinary system procedure|ICD10_code:M96821:phenoname:Accidental puncture and laceration of a musculoskeletal structure during other procedure|ICD10_code:M96820:phenoname:Accidental puncture and laceration of a musculoskeletal structure during a musculoskeletal system procedure|ICD10_code:L7612:phenoname:Accidental puncture and laceration of skin and subcutaneous tissue during other procedure|ICD10_code:L7611:phenoname:Accidental puncture and laceration of skin and subcutaneous tissue during a dermatologic procedure|ICD10_code:K9172:phenoname:Accidental puncture and laceration of a digestive system organ or structure during other procedure|ICD10_code:K9171:phenoname:Accidental puncture and laceration of a digestive system organ or structure during a digestive system procedure|ICD10_code:J9572:phenoname:Accidental puncture and laceration of a respiratory system organ or structure during other procedure|ICD10_code:J9571:phenoname:Accidental puncture and laceration of a respiratory system organ or structure during a respiratory system procedure|ICD10_code:I9752:phenoname:Accidental puncture and laceration of a circulatory system organ or structure during other procedure|ICD10_code:I9751:phenoname:Accidental puncture and laceration of a circulatory system organ or structure during a circulatory system procedure|ICD10_code:H9532:phenoname:Accidental puncture and laceration of the ear and mastoid process during other procedure|ICD10_code:H9531:phenoname:Accidental puncture and laceration of the ear and mastoid process during a procedure on the ear and mastoid process|ICD10_code:H59229:phenoname:Accidental puncture and laceration of unspecified eye and adnexa during other procedure|ICD10_code:H59219:phenoname:Accidental puncture and laceration of unspecified eye and adnexa during an ophthalmic procedure|ICD10_code:G9749:phenoname:Accidental puncture and laceration of other nervous system organ or structure during other procedure|ICD10_code:G9748:phenoname:Accidental puncture and laceration of other nervous system organ or structure during a nervous system procedure|ICD10_code:E3612:phenoname:Accidental puncture and laceration of an endocrine system organ or structure during other procedure|ICD10_code:E3611:phenoname:Accidental puncture and laceration of an endocrine system organ or structure during an endocrine system procedure|ICD10_code:D7812:phenoname:Accidental puncture and laceration of the spleen during other procedure|ICD10_code:D7811:phenoname:Accidental puncture and laceration of the spleen during a procedure on the spleen
7881	Dysuria	ICD10_code:R309:phenoname:Painful micturition, unspecified|ICD10_code:R300:phenoname:Dysuria
9623	Poisoning by insulins and antidiabetic agents	ICD10_code:T383X4A:phenoname:Poisoning by insulin and oral hypoglycemic [antidiabetic] drugs, undetermined, initial encounter|ICD10_code:T383X3A:phenoname:Poisoning by insulin and oral hypoglycemic [antidiabetic] drugs, assault, initial encounter|ICD10_code:T383X2A:phenoname:Poisoning by insulin and oral hypoglycemic [antidiabetic] drugs, intentional self-harm, initial encounter|ICD10_code:T383X1A:phenoname:Poisoning by insulin and oral hypoglycemic [antidiabetic] drugs, accidental (unintentional), initial encounter
4289	Heart failure, unspecified	ICD10_code:I509:phenoname:Heart failure, unspecified|ICD10_code:I5089:phenoname:Other heart failure|ICD10_code:I5084:phenoname:End stage heart failure|ICD10_code:I5083:phenoname:High output heart failure|ICD10_code:I5082:phenoname:Biventricular heart failure|ICD10_code:I50813:phenoname:Acute on chronic right heart failure|ICD10_code:I50812:phenoname:Chronic right heart failure|ICD10_code:I50811:phenoname:Acute right heart failure|ICD10_code:I50810:phenoname:Right heart failure, unspecified
6970	Lichen planus	ICD10_code:L661:phenoname:Lichen planopilaris|ICD10_code:L438:phenoname:Other lichen planus
2104	Benign neoplasm of other and unspecified parts of mouth	ICD10_code:D1039:phenoname:Benign neoplasm of other parts of mouth|ICD10_code:D1030:phenoname:Benign neoplasm of unspecified part of mouth
42769	Other premature beats	ICD10_code:I4949:phenoname:Other premature depolarization|ICD10_code:I493:phenoname:Ventricular premature depolarization
2811	Other vitamin B12 deficiency anemia	ICD10_code:D518:phenoname:Other vitamin B12 deficiency anemias|ICD10_code:D513:phenoname:Other dietary vitamin B12 deficiency anemia|ICD10_code:D511:phenoname:Vitamin B12 deficiency anemia due to selective vitamin B12 malabsorption with proteinuria
63310	Tubal pregnancy without intrauterine pregnancy	ICD10_code:O00109:phenoname:Unspecified tubal pregnancy without intrauterine pregnancy|ICD10_code:O00102:phenoname:Left tubal pregnancy without intrauterine pregnancy|ICD10_code:O00101:phenoname:Right tubal pregnancy without intrauterine pregnancy
7887	Urethral discharge	ICD10_code:R369:phenoname:Urethral discharge, unspecified|ICD10_code:R360:phenoname:Urethral discharge without blood
99649	Other mechanical complication of other internal orthopedic device, implant, and graft	ICD10_code:T84498A:phenoname:Other mechanical complication of other internal orthopedic devices, implants and grafts, initial encounter|ICD10_code:T84199A:phenoname:Other mechanical complication of internal fixation device of unspecified bone of limb, initial encounter|ICD10_code:T84129A:phenoname:Displacement of internal fixation device of unspecified bone of limb, initial encounter|ICD10_code:T84119A:phenoname:Breakdown (mechanical) of internal fixation device of unspecified bone of limb, initial encounter
20260	Malignant mast cell tumors, unspecified site, extranodal and solid organ sites	ICD10_code:C9629:phenoname:Other malignant mast cell neoplasm|ICD10_code:C9622:phenoname:Mast cell sarcoma|ICD10_code:C9621:phenoname:Aggressive systemic mastocytosis|ICD10_code:C9620:phenoname:Malignant mast cell neoplasm, unspecified
73315	Pathologic fracture of other specified part of femur	ICD10_code:M84750A:phenoname:Atypical femoral fracture, unspecified, initial encounter for fracture|ICD10_code:M84453A:phenoname:Pathological fracture, unspecified femur, initial encounter for fracture
78199	Other symptoms involving nervous and musculoskeletal systems	ICD10_code:R2991:phenoname:Unspecified symptoms and signs involving the musculoskeletal system|ICD10_code:R2990:phenoname:Unspecified symptoms and signs involving the nervous system|ICD10_code:R29898:phenoname:Other symptoms and signs involving the musculoskeletal system|ICD10_code:R29818:phenoname:Other symptoms and signs involving the nervous system
3321	Secondary parkinsonism	ICD10_code:G218:phenoname:Other secondary parkinsonism|ICD10_code:G2119:phenoname:Other drug induced secondary parkinsonism|ICD10_code:G2111:phenoname:Neuroleptic induced parkinsonism
2409	Goiter, unspecified	ICD10_code:E049:phenoname:Nontoxic goiter, unspecified|ICD10_code:E012:phenoname:Iodine-deficiency related (endemic) goiter, unspecified
71290	Unspecified crystal arthropathy, site unspecified	ICD10_code:M119:phenoname:Crystal arthropathy, unspecified|ICD10_code:M1180:phenoname:Other specified crystal arthropathies, unspecified site
72232	Schmorl's nodes, lumbar region	ICD10_code:M5147:phenoname:Schmorl's nodes, lumbosacral region|ICD10_code:M5146:phenoname:Schmorl's nodes, lumbar region
9273	Crushing injury of finger(s)	ICD10_code:S6710XA:phenoname:Crushing injury of unspecified finger(s), initial encounter|ICD10_code:S6700XA:phenoname:Crushing injury of unspecified thumb, initial encounter
71100	Pyogenic arthritis, site unspecified	ICD10_code:M009:phenoname:Pyogenic arthritis, unspecified|ICD10_code:M0080:phenoname:Arthritis due to other bacteria, unspecified joint|ICD10_code:M0020:phenoname:Other streptococcal arthritis, unspecified joint|ICD10_code:M0010:phenoname:Pneumococcal arthritis, unspecified joint|ICD10_code:M0000:phenoname:Staphylococcal arthritis, unspecified joint
7246	Disorders of sacrum	ICD10_code:M533:phenoname:Sacrococcygeal disorders, not elsewhere classified|ICD10_code:M532X7:phenoname:Spinal instabilities, lumbosacral region|ICD10_code:M4328:phenoname:Fusion of spine, sacral and sacrococcygeal region|ICD10_code:M4327:phenoname:Fusion of spine, lumbosacral region
4262	Left bundle branch hemiblock	ICD10_code:I4469:phenoname:Other fascicular block|ICD10_code:I4460:phenoname:Unspecified fascicular block|ICD10_code:I445:phenoname:Left posterior fascicular block|ICD10_code:I444:phenoname:Left anterior fascicular block
81405	Closed fracture of trapezium bone [larger multangular] of wrist	ICD10_code:S62176A:phenoname:Nondisplaced fracture of trapezium [larger multangular], unspecified wrist, initial encounter for closed fracture|ICD10_code:S62173A:phenoname:Displaced fracture of trapezium [larger multangular], unspecified wrist, initial encounter for closed fracture
64204	Benign essential hypertension complicating pregnancy, childbirth, and the puerperium, postpartum condition or complication	ICD10_code:O1093:phenoname:Unspecified pre-existing hypertension complicating the puerperium|ICD10_code:O1003:phenoname:Pre-existing essential hypertension complicating the puerperium
64721	Other venereal diseases of mother, complicating pregnancy, childbirth, or the puerperium, delivered, with or without mention of antepartum condition	ICD10_code:O9832:phenoname:Other infections with a predominantly sexual mode of transmission complicating childbirth|ICD10_code:O98313:phenoname:Other infections with a predominantly sexual mode of transmission complicating pregnancy, third trimester|ICD10_code:O98312:phenoname:Other infections with a predominantly sexual mode of transmission complicating pregnancy, second trimester|ICD10_code:O98311:phenoname:Other infections with a predominantly sexual mode of transmission complicating pregnancy, first trimester
64793	Unspecified infection or infestation of mother, antepartum condition or complication	ICD10_code:O98913:phenoname:Unspecified maternal infectious and parasitic disease complicating pregnancy, third trimester|ICD10_code:O98912:phenoname:Unspecified maternal infectious and parasitic disease complicating pregnancy, second trimester|ICD10_code:O98911:phenoname:Unspecified maternal infectious and parasitic disease complicating pregnancy, first trimester
2552	Adrenogenital disorders	ICD10_code:E259:phenoname:Adrenogenital disorder, unspecified|ICD10_code:E258:phenoname:Other adrenogenital disorders|ICD10_code:E250:phenoname:Congenital adrenogenital disorders associated with enzyme deficiency
96903	Poisoning by selective serotonin reuptake inhibitors	ICD10_code:T43224A:phenoname:Poisoning by selective serotonin reuptake inhibitors, undetermined, initial encounter|ICD10_code:T43223A:phenoname:Poisoning by selective serotonin reuptake inhibitors, assault, initial encounter|ICD10_code:T43222A:phenoname:Poisoning by selective serotonin reuptake inhibitors, intentional self-harm, initial encounter|ICD10_code:T43221A:phenoname:Poisoning by selective serotonin reuptake inhibitors, accidental (unintentional), initial encounter
1869	Malignant neoplasm of other and unspecified testis	ICD10_code:C6290:phenoname:Malignant neoplasm of unspecified testis, unspecified whether descended or undescended|ICD10_code:C6210:phenoname:Malignant neoplasm of unspecified descended testis
96909	Poisoning by other antidepressants	ICD10_code:T43294A:phenoname:Poisoning by other antidepressants, undetermined, initial encounter|ICD10_code:T43293A:phenoname:Poisoning by other antidepressants, assault, initial encounter|ICD10_code:T43292A:phenoname:Poisoning by other antidepressants, intentional self-harm, initial encounter|ICD10_code:T43291A:phenoname:Poisoning by other antidepressants, accidental (unintentional), initial encounter
52461	Temporomandibular joint disorders, adhesions and ankylosis (bony or fibrous)	ICD10_code:M26619:phenoname:Adhesions and ankylosis of temporomandibular joint, unspecified side|ICD10_code:M26613:phenoname:Adhesions and ankylosis of bilateral temporomandibular joint|ICD10_code:M26612:phenoname:Adhesions and ankylosis of left temporomandibular joint|ICD10_code:M26611:phenoname:Adhesions and ankylosis of right temporomandibular joint
81612	Open fracture of distal phalanx or phalanges of hand	ICD10_code:S62669B:phenoname:Nondisplaced fracture of distal phalanx of unspecified finger, initial encounter for open fracture|ICD10_code:S62639B:phenoname:Displaced fracture of distal phalanx of unspecified finger, initial encounter for open fracture|ICD10_code:S62526B:phenoname:Nondisplaced fracture of distal phalanx of unspecified thumb, initial encounter for open fracture|ICD10_code:S62523B:phenoname:Displaced fracture of distal phalanx of unspecified thumb, initial encounter for open fracture
7142	Other rheumatoid arthritis with visceral or systemic involvement	ICD10_code:M061:phenoname:Adult-onset Still's disease|ICD10_code:M0560:phenoname:Rheumatoid arthritis of unspecified site with involvement of other organs and systems|ICD10_code:M0530:phenoname:Rheumatoid heart disease with rheumatoid arthritis of unspecified site
69271	Sunburn	ICD10_code:L559:phenoname:Sunburn, unspecified|ICD10_code:L550:phenoname:Sunburn of first degree
99609	Other mechanical complication of cardiac device, implant, and graft	ICD10_code:T82598A:phenoname:Other mechanical complication of other cardiac and vascular devices and implants, initial encounter|ICD10_code:T82538A:phenoname:Leakage of other cardiac and vascular devices and implants, initial encounter|ICD10_code:T82528A:phenoname:Displacement of other cardiac and vascular devices and implants, initial encounter|ICD10_code:T82518A:phenoname:Breakdown (mechanical) of other cardiac and vascular devices and implants, initial encounter|ICD10_code:T82228A:phenoname:Other mechanical complication of biological heart valve graft, initial encounter|ICD10_code:T82223A:phenoname:Leakage of biological heart valve graft, initial encounter|ICD10_code:T82222A:phenoname:Displacement of biological heart valve graft, initial encounter|ICD10_code:T82221A:phenoname:Breakdown (mechanical) of biological heart valve graft, initial encounter
1718	Malignant neoplasm of other specified sites of connective and other soft tissue	ICD10_code:C498:phenoname:Malignant neoplasm of overlapping sites of connective and soft tissue|ICD10_code:C478:phenoname:Malignant neoplasm of overlapping sites of peripheral nerves and autonomic nervous system
1922	Malignant neoplasm of spinal cord	ICD10_code:C721:phenoname:Malignant neoplasm of cauda equina|ICD10_code:C720:phenoname:Malignant neoplasm of spinal cord
94427	Blisters, epidermal loss [second degree] of wrist	ICD10_code:T23679A:phenoname:Corrosion of second degree of unspecified wrist, initial encounter|ICD10_code:T23279A:phenoname:Burn of second degree of unspecified wrist, initial encounter
38532	Cholesteatoma of middle ear	ICD10_code:H7440:phenoname:Polyp of middle ear, unspecified ear|ICD10_code:H7113:phenoname:Cholesteatoma of tympanum, bilateral
2751	Disorders of copper metabolism	ICD10_code:E8309:phenoname:Other disorders of copper metabolism|ICD10_code:E8301:phenoname:Wilson's disease|ICD10_code:E8300:phenoname:Disorder of copper metabolism, unspecified
6829	Cellulitis and abscess of unspecified sites	ICD10_code:L0391:phenoname:Acute lymphangitis, unspecified|ICD10_code:L0390:phenoname:Cellulitis, unspecified
9911	Frostbite of hand	ICD10_code:T34529A:phenoname:Frostbite with tissue necrosis of unspecified hand, initial encounter|ICD10_code:T33529A:phenoname:Superficial frostbite of unspecified hand, initial encounter
81102	Closed fracture of coracoid process of scapula	ICD10_code:S42136A:phenoname:Nondisplaced fracture of coracoid process, unspecified shoulder, initial encounter for closed fracture|ICD10_code:S42133A:phenoname:Displaced fracture of coracoid process, unspecified shoulder, initial encounter for closed fracture
7102	Sicca syndrome	ICD10_code:M3501:phenoname:Sicca syndrome with keratoconjunctivitis|ICD10_code:M3500:phenoname:Sicca syndrome, unspecified
8970	Traumatic amputation of leg(s) (complete) (partial), unilateral, below knee, without mention of complication	ICD10_code:S88129A:phenoname:Partial traumatic amputation at level between knee and ankle, unspecified lower leg, initial encounter|ICD10_code:S88119A:phenoname:Complete traumatic amputation at level between knee and ankle, unspecified lower leg, initial encounter
9693	Poisoning by other antipsychotics, neuroleptics, and major tranquilizers	ICD10_code:T43594A:phenoname:Poisoning by other antipsychotics and neuroleptics, undetermined, initial encounter|ICD10_code:T43593A:phenoname:Poisoning by other antipsychotics and neuroleptics, assault, initial encounter|ICD10_code:T43592A:phenoname:Poisoning by other antipsychotics and neuroleptics, intentional self-harm, initial encounter|ICD10_code:T43591A:phenoname:Poisoning by other antipsychotics and neuroleptics, accidental (unintentional), initial encounter|ICD10_code:T43504A:phenoname:Poisoning by unspecified antipsychotics and neuroleptics, undetermined, initial encounter|ICD10_code:T43503A:phenoname:Poisoning by unspecified antipsychotics and neuroleptics, assault, initial encounter|ICD10_code:T43502A:phenoname:Poisoning by unspecified antipsychotics and neuroleptics, intentional self-harm, initial encounter|ICD10_code:T43501A:phenoname:Poisoning by unspecified antipsychotics and neuroleptics, accidental (unintentional), initial encounter
