icd9_code	icd9_phe	potential_matches
931	Foreign body in ear	ICD10_code:T169XXA:phenoname:Foreign body in ear, unspecified ear, initial encounter|ICD10_code:T162XXA:phenoname:Foreign body in left ear, initial encounter|ICD10_code:T161XXA:phenoname:Foreign body in right ear, initial encounter
7576	Specified congenital anomalies of breast	ICD10_code:Q838:phenoname:Other congenital malformations of breast|ICD10_code:Q833:phenoname:Accessory nipple|ICD10_code:Q832:phenoname:Absent nipple|ICD10_code:Q831:phenoname:Accessory breast|ICD10_code:Q830:phenoname:Congenital absence of breast with absent nipple
81109	Closed fracture of scapula, other	ICD10_code:S42199A:phenoname:Fracture of other part of scapula, unspecified shoulder, initial encounter for closed fracture|ICD10_code:S42116A:phenoname:Nondisplaced fracture of body of scapula, unspecified shoulder, initial encounter for closed fracture|ICD10_code:S42113A:phenoname:Displaced fracture of body of scapula, unspecified shoulder, initial encounter for closed fracture
99600	Mechanical complication of unspecified cardiac device, implant, and graft	ICD10_code:T82599A:phenoname:Other mechanical complication of unspecified cardiac and vascular devices and implants, initial encounter|ICD10_code:T82539A:phenoname:Leakage of unspecified cardiac and vascular devices and implants, initial encounter|ICD10_code:T82529A:phenoname:Displacement of unspecified cardiac and vascular devices and implants, initial encounter|ICD10_code:T82519A:phenoname:Breakdown (mechanical) of unspecified cardiac and vascular devices and implants, initial encounter
7823	Edema	ICD10_code:R609:phenoname:Edema, unspecified|ICD10_code:R601:phenoname:Generalized edema|ICD10_code:R600:phenoname:Localized edema
80228	Closed fracture of mandible, body, other and unspecified	ICD10_code:S02602A:phenoname:Fracture of unspecified part of body of left mandible, initial encounter for closed fracture|ICD10_code:S02601A:phenoname:Fracture of unspecified part of body of right mandible, initial encounter for closed fracture|ICD10_code:S02600A:phenoname:Fracture of unspecified part of body of mandible, unspecified side, initial encounter for closed fracture
30744	Persistent disorder of initiating or maintaining wakefulness	ICD10_code:F5119:phenoname:Other hypersomnia not due to a substance or known physiological condition|ICD10_code:F5112:phenoname:Insufficient sleep syndrome|ICD10_code:F5111:phenoname:Primary hypersomnia
20290	Other and unspecified malignant neoplasms of lymphoid and histiocytic tissue, unspecified site, extranodal and solid organ sites	ICD10_code:C96Z:phenoname:Other specified malignant neoplasms of lymphoid, hematopoietic and related tissue|ICD10_code:C969:phenoname:Malignant neoplasm of lymphoid, hematopoietic and related tissue, unspecified|ICD10_code:C964:phenoname:Sarcoma of dendritic cells (accessory cells)
38840	Abnormal auditory perception, unspecified	ICD10_code:H93299:phenoname:Other abnormal auditory perceptions, unspecified ear|ICD10_code:H93249:phenoname:Temporary auditory threshold shift, unspecified ear
65823	Delayed delivery after spontaneous or unspecified rupture of membranes, antepartum condition or complication	ICD10_code:O42113:phenoname:Preterm premature rupture of membranes, onset of labor more than 24 hours following rupture, third trimester|ICD10_code:O42112:phenoname:Preterm premature rupture of membranes, onset of labor more than 24 hours following rupture, second trimester|ICD10_code:O42111:phenoname:Preterm premature rupture of membranes, onset of labor more than 24 hours following rupture, first trimester
66331	Other and unspecified cord entanglement, without mention of compression, complicating labor and delivery, delivered, with or without mention of antepartum condition	ICD10_code:O6989X0:phenoname:Labor and delivery complicated by other cord complications, not applicable or unspecified|ICD10_code:O6982X0:phenoname:Labor and delivery complicated by other cord entanglement, without compression, not applicable or unspecified|ICD10_code:O6981X0:phenoname:Labor and delivery complicated by cord around neck, without compression, not applicable or unspecified
64100	Placenta previa without hemorrhage, unspecified as to episode of care or not applicable	ICD10_code:O4440:phenoname:Low lying placenta NOS or without hemorrhage, unspecified trimester|ICD10_code:O4420:phenoname:Partial placenta previa NOS or without hemorrhage, unspecified trimester|ICD10_code:O4400:phenoname:Complete placenta previa NOS or without hemorrhage, unspecified trimester
2111	Benign neoplasm of stomach	ICD10_code:K317:phenoname:Polyp of stomach and duodenum|ICD10_code:D131:phenoname:Benign neoplasm of stomach
9651	Poisoning by salicylates	ICD10_code:T39314A:phenoname:Poisoning by propionic acid derivatives, undetermined, initial encounter|ICD10_code:T39094A:phenoname:Poisoning by salicylates, undetermined, initial encounter|ICD10_code:T39093A:phenoname:Poisoning by salicylates, assault, initial encounter|ICD10_code:T39092A:phenoname:Poisoning by salicylates, intentional self-harm, initial encounter|ICD10_code:T39091A:phenoname:Poisoning by salicylates, accidental (unintentional), initial encounter|ICD10_code:T39014A:phenoname:Poisoning by aspirin, undetermined, initial encounter|ICD10_code:T39013A:phenoname:Poisoning by aspirin, assault, initial encounter|ICD10_code:T39012A:phenoname:Poisoning by aspirin, intentional self-harm, initial encounter|ICD10_code:T39011A:phenoname:Poisoning by aspirin, accidental (unintentional), initial encounter
64671	Liver and biliary tract disorders in pregnancy, delivered, with or without mention of antepartum condition	ICD10_code:O2662:phenoname:Liver and biliary tract disorders in childbirth|ICD10_code:O26613:phenoname:Liver and biliary tract disorders in pregnancy, third trimester|ICD10_code:O26612:phenoname:Liver and biliary tract disorders in pregnancy, second trimester|ICD10_code:O26611:phenoname:Liver and biliary tract disorders in pregnancy, first trimester
64783	Other specified infectious and parasitic diseases of mother, antepartum condition or complication	ICD10_code:O98813:phenoname:Other maternal infectious and parasitic diseases complicating pregnancy, third trimester|ICD10_code:O98812:phenoname:Other maternal infectious and parasitic diseases complicating pregnancy, second trimester|ICD10_code:O98811:phenoname:Other maternal infectious and parasitic diseases complicating pregnancy, first trimester|ICD10_code:O98613:phenoname:Protozoal diseases complicating pregnancy, third trimester|ICD10_code:O98612:phenoname:Protozoal diseases complicating pregnancy, second trimester|ICD10_code:O98611:phenoname:Protozoal diseases complicating pregnancy, first trimester
7018	Other specified hypertrophic and atrophic conditions of skin	ICD10_code:L985:phenoname:Mucinosis of the skin|ICD10_code:L922:phenoname:Granuloma faciale [eosinophilic granuloma of skin]|ICD10_code:L918:phenoname:Other hypertrophic disorders of the skin|ICD10_code:L908:phenoname:Other atrophic disorders of skin|ICD10_code:L904:phenoname:Acrodermatitis chronica atrophicans|ICD10_code:L664:phenoname:Folliculitis ulerythematosa reticulata|ICD10_code:L574:phenoname:Cutis laxa senilis|ICD10_code:L572:phenoname:Cutis rhomboidalis nuchae|ICD10_code:L119:phenoname:Acantholytic disorder, unspecified
64213	Hypertension secondary to renal disease, complicating pregnancy, childbirth, and the puerperium, antepartum condition or complication	ICD10_code:O10413:phenoname:Pre-existing secondary hypertension complicating pregnancy, third trimester|ICD10_code:O10412:phenoname:Pre-existing secondary hypertension complicating pregnancy, second trimester|ICD10_code:O10411:phenoname:Pre-existing secondary hypertension complicating pregnancy, first trimester
25510	Hyperaldosteronism, unspecified	ICD10_code:E269:phenoname:Hyperaldosteronism, unspecified|ICD10_code:E2609:phenoname:Other primary hyperaldosteronism
7575	Specified anomalies of nails	ICD10_code:Q846:phenoname:Other congenital malformations of nails|ICD10_code:Q845:phenoname:Enlarged and hypertrophic nails|ICD10_code:Q844:phenoname:Congenital leukonychia|ICD10_code:Q843:phenoname:Anonychia
7078	Chronic ulcer of other specified sites	ICD10_code:L98429:phenoname:Non-pressure chronic ulcer of back with unspecified severity|ICD10_code:L98419:phenoname:Non-pressure chronic ulcer of buttock with unspecified severity
94323	Blisters, epidermal loss [second degree] of upper arm	ICD10_code:T22639A:phenoname:Corrosion of second degree of unspecified upper arm, initial encounter|ICD10_code:T22239A:phenoname:Burn of second degree of unspecified upper arm, initial encounter
27503	Other hemochromatosis	ICD10_code:E83119:phenoname:Hemochromatosis, unspecified|ICD10_code:E83118:phenoname:Other hemochromatosis
94223	Blisters, epidermal loss [second degree] of abdominal wall	ICD10_code:T2162XA:phenoname:Corrosion of second degree of abdominal wall, initial encounter|ICD10_code:T2122XA:phenoname:Burn of second degree of abdominal wall, initial encounter
6850	Pilonidal cyst with abscess	ICD10_code:L0502:phenoname:Pilonidal sinus with abscess|ICD10_code:L0501:phenoname:Pilonidal cyst with abscess
1943	Malignant neoplasm of pituitary gland and craniopharyngeal duct	ICD10_code:C752:phenoname:Malignant neoplasm of craniopharyngeal duct|ICD10_code:C751:phenoname:Malignant neoplasm of pituitary gland
20240	Leukemic reticuloendotheliosis, unspecified site, extranodal and solid organ sites	ICD10_code:C9141:phenoname:Hairy cell leukemia, in remission|ICD10_code:C9140:phenoname:Hairy cell leukemia not having achieved remission
2113	Benign neoplasm of colon	ICD10_code:K635:phenoname:Polyp of colon|ICD10_code:D126:phenoname:Benign neoplasm of colon, unspecified|ICD10_code:D121:phenoname:Benign neoplasm of appendix|ICD10_code:D120:phenoname:Benign neoplasm of cecum
96900	Poisoning by antidepressant, unspecified	ICD10_code:T43204A:phenoname:Poisoning by unspecified antidepressants, undetermined, initial encounter|ICD10_code:T43203A:phenoname:Poisoning by unspecified antidepressants, assault, initial encounter|ICD10_code:T43202A:phenoname:Poisoning by unspecified antidepressants, intentional self-harm, initial encounter|ICD10_code:T43201A:phenoname:Poisoning by unspecified antidepressants, accidental (unintentional), initial encounter
5130	Abscess of lung	ICD10_code:J852:phenoname:Abscess of lung without pneumonia|ICD10_code:J851:phenoname:Abscess of lung with pneumonia|ICD10_code:J850:phenoname:Gangrene and necrosis of lung
2300	Carcinoma in situ of lip, oral cavity, and pharynx	ICD10_code:D0008:phenoname:Carcinoma in situ of pharynx|ICD10_code:D0007:phenoname:Carcinoma in situ of tongue|ICD10_code:D0006:phenoname:Carcinoma in situ of floor of mouth|ICD10_code:D0005:phenoname:Carcinoma in situ of hard palate|ICD10_code:D0004:phenoname:Carcinoma in situ of soft palate|ICD10_code:D0003:phenoname:Carcinoma in situ of gingiva and edentulous alveolar ridge|ICD10_code:D0002:phenoname:Carcinoma in situ of buccal mucosa|ICD10_code:D0001:phenoname:Carcinoma in situ of labial mucosa and vermilion border|ICD10_code:D0000:phenoname:Carcinoma in situ of oral cavity, unspecified site
7424	Other specified congenital anomalies of brain	ICD10_code:Q048:phenoname:Other specified congenital malformations of brain|ICD10_code:Q046:phenoname:Congenital cerebral cysts|ICD10_code:Q045:phenoname:Megalencephaly
74731	Pulmonary artery coarctation and atresia	ICD10_code:Q2571:phenoname:Coarctation of pulmonary artery|ICD10_code:Q255:phenoname:Atresia of pulmonary artery
64781	Other specified infectious and parasitic diseases of mother, delivered, with or without mention of antepartum condition	ICD10_code:O99834:phenoname:Other infection carrier state complicating childbirth|ICD10_code:O9882:phenoname:Other maternal infectious and parasitic diseases complicating childbirth|ICD10_code:O98813:phenoname:Other maternal infectious and parasitic diseases complicating pregnancy, third trimester|ICD10_code:O98812:phenoname:Other maternal infectious and parasitic diseases complicating pregnancy, second trimester|ICD10_code:O98811:phenoname:Other maternal infectious and parasitic diseases complicating pregnancy, first trimester|ICD10_code:O98613:phenoname:Protozoal diseases complicating pregnancy, third trimester|ICD10_code:O98612:phenoname:Protozoal diseases complicating pregnancy, second trimester|ICD10_code:O98611:phenoname:Protozoal diseases complicating pregnancy, first trimester
71504	Osteoarthrosis, generalized, hand	ICD10_code:M152:phenoname:Bouchard's nodes (with arthropathy)|ICD10_code:M151:phenoname:Heberden's nodes (with arthropathy)
94320	Blisters, epidermal loss [second degree] of upper limb, unspecified site	ICD10_code:T2260XA:phenoname:Corrosion of second degree of shoulder and upper limb, except wrist and hand, unspecified site, initial encounter|ICD10_code:T2220XA:phenoname:Burn of second degree of shoulder and upper limb, except wrist and hand, unspecified site, initial encounter
68110	Cellulitis and abscess of toe, unspecified	ICD10_code:L03049:phenoname:Acute lymphangitis of unspecified toe|ICD10_code:L03039:phenoname:Cellulitis of unspecified toe
64660	Infections of genitourinary tract in pregnancy, unspecified as to episode of care or not applicable	ICD10_code:O2390:phenoname:Unspecified genitourinary tract infection in pregnancy, unspecified trimester|ICD10_code:O23599:phenoname:Infection of other part of genital tract in pregnancy, unspecified trimester|ICD10_code:O23529:phenoname:Salpingo-oophoritis in pregnancy, unspecified trimester|ICD10_code:O23519:phenoname:Infections of cervix in pregnancy, unspecified trimester|ICD10_code:O2340:phenoname:Unspecified infection of urinary tract in pregnancy, unspecified trimester|ICD10_code:O2330:phenoname:Infections of other parts of urinary tract in pregnancy, unspecified trimester|ICD10_code:O2320:phenoname:Infections of urethra in pregnancy, unspecified trimester|ICD10_code:O2310:phenoname:Infections of bladder in pregnancy, unspecified trimester|ICD10_code:O2300:phenoname:Infections of kidney in pregnancy, unspecified trimester
3139	Unspecified emotional disturbance of childhood or adolescence	ICD10_code:F989:phenoname:Unspecified behavioral and emotional disorders with onset usually occurring in childhood and adolescence|ICD10_code:F948:phenoname:Other childhood disorders of social functioning|ICD10_code:F939:phenoname:Childhood emotional disorder, unspecified
33510	Spinal muscular atrophy, unspecified	ICD10_code:G129:phenoname:Spinal muscular atrophy, unspecified|ICD10_code:G1225:phenoname:Progressive spinal muscle atrophy
7504	Other specified anomalies of esophagus	ICD10_code:Q398:phenoname:Other congenital malformations of esophagus|ICD10_code:Q396:phenoname:Congenital diverticulum of esophagus|ICD10_code:Q395:phenoname:Congenital dilatation of esophagus
7530	Renal agenesis and dysgenesis	ICD10_code:Q605:phenoname:Renal hypoplasia, unspecified|ICD10_code:Q602:phenoname:Renal agenesis, unspecified
71742	Derangement of anterior horn of lateral meniscus	ICD10_code:M23349:phenoname:Other meniscus derangements, anterior horn of lateral meniscus, unspecified knee|ICD10_code:M23249:phenoname:Derangement of anterior horn of lateral meniscus due to old tear or injury, unspecified knee
5570	Acute vascular insufficiency of intestine	ICD10_code:K5533:phenoname:Stage 3 necrotizing enterocolitis|ICD10_code:K5532:phenoname:Stage 2 necrotizing enterocolitis|ICD10_code:K5531:phenoname:Stage 1 necrotizing enterocolitis|ICD10_code:K5530:phenoname:Necrotizing enterocolitis, unspecified|ICD10_code:K55069:phenoname:Acute infarction of intestine, part and extent unspecified|ICD10_code:K55062:phenoname:Diffuse acute infarction of intestine, part unspecified|ICD10_code:K55061:phenoname:Focal (segmental) acute infarction of intestine, part unspecified|ICD10_code:K55059:phenoname:Acute (reversible) ischemia of intestine, part and extent unspecified|ICD10_code:K55052:phenoname:Diffuse acute (reversible) ischemia of intestine, part unspecified|ICD10_code:K55051:phenoname:Focal (segmental) acute (reversible) ischemia of intestine, part unspecified|ICD10_code:K55049:phenoname:Acute infarction of large intestine, extent unspecified|ICD10_code:K55042:phenoname:Diffuse acute infarction of large intestine|ICD10_code:K55041:phenoname:Focal (segmental) acute infarction of large intestine|ICD10_code:K55039:phenoname:Acute (reversible) ischemia of large intestine, extent unspecified|ICD10_code:K55032:phenoname:Diffuse acute (reversible) ischemia of large intestine|ICD10_code:K55031:phenoname:Focal (segmental) acute (reversible) ischemia of large intestine|ICD10_code:K55029:phenoname:Acute infarction of small intestine, extent unspecified|ICD10_code:K55022:phenoname:Diffuse acute infarction of small intestine|ICD10_code:K55021:phenoname:Focal (segmental) acute infarction of small intestine|ICD10_code:K55019:phenoname:Acute (reversible) ischemia of small intestine, extent unspecified|ICD10_code:K55012:phenoname:Diffuse acute (reversible) ischemia of small intestine|ICD10_code:K55011:phenoname:Focal (segmental) acute (reversible) ischemia of small intestine
65653	Poor fetal growth, affecting management of mother, antepartum condition or complication	ICD10_code:O365930:phenoname:Maternal care for other known or suspected poor fetal growth, third trimester, not applicable or unspecified|ICD10_code:O365920:phenoname:Maternal care for other known or suspected poor fetal growth, second trimester, not applicable or unspecified|ICD10_code:O365910:phenoname:Maternal care for other known or suspected poor fetal growth, first trimester, not applicable or unspecified|ICD10_code:O365130:phenoname:Maternal care for known or suspected placental insufficiency, third trimester, not applicable or unspecified|ICD10_code:O365120:phenoname:Maternal care for known or suspected placental insufficiency, second trimester, not applicable or unspecified|ICD10_code:O365110:phenoname:Maternal care for known or suspected placental insufficiency, first trimester, not applicable or unspecified
9972	Peripheral vascular complications, not elsewhere classified	ICD10_code:T8172XA:phenoname:Complication of vein following a procedure, not elsewhere classified, initial encounter|ICD10_code:T81719A:phenoname:Complication of unspecified artery following a procedure, not elsewhere classified, initial encounter
17351	Basal cell carcinoma of skin of trunk, except scrotum	ICD10_code:C44519:phenoname:Basal cell carcinoma of skin of other part of trunk|ICD10_code:C44511:phenoname:Basal cell carcinoma of skin of breast|ICD10_code:C44510:phenoname:Basal cell carcinoma of anal skin
78909	Abdominal pain, other specified site	ICD10_code:R1030:phenoname:Lower abdominal pain, unspecified|ICD10_code:R102:phenoname:Pelvic and perineal pain|ICD10_code:R1010:phenoname:Upper abdominal pain, unspecified
5439	Other and unspecified diseases of appendix	ICD10_code:K389:phenoname:Disease of appendix, unspecified|ICD10_code:K388:phenoname:Other specified diseases of appendix|ICD10_code:K383:phenoname:Fistula of appendix|ICD10_code:K382:phenoname:Diverticulum of appendix|ICD10_code:K381:phenoname:Appendicular concretions
99664	Infection and inflammatory reaction due to indwelling urinary catheter	ICD10_code:T83518A:phenoname:Infection and inflammatory reaction due to other urinary catheter, initial encounter|ICD10_code:T83512A:phenoname:Infection and inflammatory reaction due to nephrostomy catheter, initial encounter|ICD10_code:T83511A:phenoname:Infection and inflammatory reaction due to indwelling urethral catheter, initial encounter|ICD10_code:T83510A:phenoname:Infection and inflammatory reaction due to cystostomy catheter, initial encounter
31539	Other developmental speech or language disorder	ICD10_code:F8089:phenoname:Other developmental disorders of speech and language|ICD10_code:F8082:phenoname:Social pragmatic communication disorder|ICD10_code:F800:phenoname:Phonological disorder
0340	Streptococcal sore throat	ICD10_code:J0300:phenoname:Acute streptococcal tonsillitis, unspecified|ICD10_code:J020:phenoname:Streptococcal pharyngitis
7279	Unspecified disorder of synovium, tendon, and bursa	ICD10_code:M719:phenoname:Bursopathy, unspecified|ICD10_code:M6790:phenoname:Unspecified disorder of synovium and tendon, unspecified site
9074	Late effect of injury to peripheral nerve of shoulder girdle and upper limb	ICD10_code:S6490XS:phenoname:Injury of unspecified nerve at wrist and hand level of unspecified arm, sequela|ICD10_code:S5490XS:phenoname:Injury of unspecified nerve at forearm level, unspecified arm, sequela|ICD10_code:S4490XS:phenoname:Injury of unspecified nerve at shoulder and upper arm level, unspecified arm, sequela
6961	Other psoriasis	ICD10_code:L408:phenoname:Other psoriasis|ICD10_code:L404:phenoname:Guttate psoriasis|ICD10_code:L403:phenoname:Pustulosis palmaris et plantaris|ICD10_code:L402:phenoname:Acrodermatitis continua|ICD10_code:L401:phenoname:Generalized pustular psoriasis|ICD10_code:L400:phenoname:Psoriasis vulgaris
9889	Toxic effect of unspecified noxious substance eaten as food	ICD10_code:T6294XA:phenoname:Toxic effect of unspecified noxious substance eaten as food, undetermined, initial encounter|ICD10_code:T6293XA:phenoname:Toxic effect of unspecified noxious substance eaten as food, assault, initial encounter|ICD10_code:T6292XA:phenoname:Toxic effect of unspecified noxious substance eaten as food, intentional self-harm, initial encounter|ICD10_code:T6291XA:phenoname:Toxic effect of unspecified noxious substance eaten as food, accidental (unintentional), initial encounter
47819	Other disease of nasal cavity and sinuses	ICD10_code:J3489:phenoname:Other specified disorders of nose and nasal sinuses|ICD10_code:J341:phenoname:Cyst and mucocele of nose and nasal sinus|ICD10_code:J340:phenoname:Abscess, furuncle and carbuncle of nose
75251	Undescended testis	ICD10_code:Q539:phenoname:Undescended testicle, unspecified|ICD10_code:Q5313:phenoname:Unilateral high scrotal testis
80230	Open fracture of mandible, unspecified site	ICD10_code:S0269XB:phenoname:Fracture of mandible of other specified site, initial encounter for open fracture|ICD10_code:S02609B:phenoname:Fracture of mandible, unspecified, initial encounter for open fracture
37821	Intermittent esotropia, monocular	ICD10_code:H50312:phenoname:Intermittent monocular esotropia, left eye|ICD10_code:H50311:phenoname:Intermittent monocular esotropia, right eye
44281	Aneurysm of artery of neck	ICD10_code:I726:phenoname:Aneurysm of vertebral artery|ICD10_code:I725:phenoname:Aneurysm of other precerebral arteries|ICD10_code:I720:phenoname:Aneurysm of carotid artery
65421	Previous cesarean delivery, delivered, with or without mention of antepartum condition	ICD10_code:O34219:phenoname:Maternal care for unspecified type scar from previous cesarean delivery|ICD10_code:O34212:phenoname:Maternal care for vertical scar from previous cesarean delivery|ICD10_code:O34211:phenoname:Maternal care for low transverse scar from previous cesarean delivery
8481	Sprain of jaw	ICD10_code:S0343XA:phenoname:Sprain of jaw, bilateral, initial encounter|ICD10_code:S0342XA:phenoname:Sprain of jaw, left side, initial encounter|ICD10_code:S0341XA:phenoname:Sprain of jaw, right side, initial encounter|ICD10_code:S0340XA:phenoname:Sprain of jaw, unspecified side, initial encounter
74346	Other specified congenital anomalies of iris and ciliary body	ICD10_code:Q132:phenoname:Other congenital malformations of iris|ICD10_code:Q130:phenoname:Coloboma of iris
8024	Closed fracture of malar and maxillary bones	ICD10_code:S0240FA:phenoname:Zygomatic fracture, left side, initial encounter for closed fracture|ICD10_code:S0240EA:phenoname:Zygomatic fracture, right side, initial encounter for closed fracture|ICD10_code:S0240DA:phenoname:Maxillary fracture, left side, initial encounter for closed fracture|ICD10_code:S0240CA:phenoname:Maxillary fracture, right side, initial encounter for closed fracture|ICD10_code:S0240BA:phenoname:Malar fracture, left side, initial encounter for closed fracture|ICD10_code:S0240AA:phenoname:Malar fracture, right side, initial encounter for closed fracture|ICD10_code:S02402A:phenoname:Zygomatic fracture, unspecified side, initial encounter for closed fracture|ICD10_code:S02401A:phenoname:Maxillary fracture, unspecified side, initial encounter for closed fracture|ICD10_code:S02400A:phenoname:Malar fracture, unspecified side, initial encounter for closed fracture
9091	Late effect of toxic effects of nonmedical substances	ICD10_code:T6594XS:phenoname:Toxic effect of unspecified substance, undetermined, sequela|ICD10_code:T6593XS:phenoname:Toxic effect of unspecified substance, assault, sequela|ICD10_code:T6592XS:phenoname:Toxic effect of unspecified substance, intentional self-harm, sequela|ICD10_code:T6591XS:phenoname:Toxic effect of unspecified substance, accidental (unintentional), sequela
99681	Complications of transplanted kidney	ICD10_code:T8612:phenoname:Kidney transplant failure|ICD10_code:T8611:phenoname:Kidney transplant rejection|ICD10_code:T8610:phenoname:Unspecified complication of kidney transplant
20190	Hodgkin's disease, unspecified type, unspecified site, extranodal and solid organ sites	ICD10_code:C8199:phenoname:Hodgkin lymphoma, unspecified, extranodal and solid organ sites|ICD10_code:C8190:phenoname:Hodgkin lymphoma, unspecified, unspecified site
